{
  "claim_boundary": {
    "public_adoption_claim_created": false,
    "public_benchmark_claim_created": false,
    "public_compatibility_claim_created": false,
    "public_endorsement_claim_created": false,
    "public_savings_claim_created": false,
    "public_security_claim_created": false,
    "public_support_claim_created": false,
    "stable_protocol_claim_created": false
  },
  "command_shapes": {
    "gate": "python3 scripts/run_memory_state_influence_boundary_report.py --input <memory-state-path> --format gate --fail-on-blocked",
    "report": "python3 scripts/run_memory_state_influence_boundary_report.py --input <memory-state-path>"
  },
  "consumer_policy": "block when the report fails, the gate fails, or blocked_ref_count > 0; otherwise allow inform-only use",
  "decision": {
    "blocked_ref_count": 4,
    "consumed_raw_content": false,
    "decision": "block",
    "gate_passed": false,
    "gate_returncode": 2,
    "omitted_ref_count": 0,
    "raw_content_included": false,
    "reason": "blocked_refs_present",
    "report_status": "pass_memory_state_influence_boundary_report"
  },
  "errors": [],
  "gate": {
    "blocked_ref_count": 4,
    "default_exit_code": 0,
    "fail_on_blocked_exit_code": 2,
    "imported_context_ref_count": 1,
    "omitted_ref_count": 0,
    "passed": false,
    "raw_content_included": false,
    "schema_id": "ctxvault.memory-state-influence-boundary-integration-gate/v0",
    "stale_or_superseded_ref_count": 2
  },
  "gate_returncode": 2,
  "input": "examples/memory-state-influence-boundary",
  "milestone": "Local Memory State Influence Boundary Report",
  "outreach_performed": false,
  "publication_executed": false,
  "report_output_files": {
    "html": ".ctxvault/memory-state-governability-overlay/consumer-wrapper-example/report/influence-boundary-report.html",
    "json": ".ctxvault/memory-state-governability-overlay/consumer-wrapper-example/report/influence-boundary-report.json",
    "markdown": ".ctxvault/memory-state-governability-overlay/consumer-wrapper-example/report/influence-boundary-report.md"
  },
  "report_status": "pass_memory_state_influence_boundary_report",
  "schema_id": "ctxvault.memory-state-influence-boundary-consumer-wrapper-example/v0",
  "side_effect_boundary": {
    "external_runtime_or_adapter_executed": false,
    "memory_backend_written": false,
    "network_access_performed": false,
    "outreach_performed": false,
    "provider_or_model_call_performed": false,
    "public_release_created": false,
    "sarif_uploaded": false,
    "target_file_written": false
  },
  "status": "pass_memory_state_influence_boundary_consumer_wrapper_example"
}
